<?xml version="1.0" encoding="UTF-8" standalone="no"?>
<!DOCTYPE superheromovies SYSTEM "filmer.dtd"> 
   
<superheromovies>

    <movie>
        <name>Hellboy</name>
        <when>2019</when>
        <length>2h</length>
        <imdb url="https://www.imdb.com/title/tt2274648/?ref_=nv_sr_srsg_3" />
    </movie>

    <movie>
        <name>The Incredibles</name>
        <when>2004</when>
        <length>1h 55m</length>
        <imdb url="https://www.imdb.com/title/tt0317705/?ref_=nv_sr_srsg_3"/>
    </movie>

    <movie>
        <name>Teenage Mutant Ninja Turtles</name>
        <when>2014</when>
        <length>1h 41m</length>
        <imdb url="https://www.imdb.com/title/tt1291150/?ref_=nv_sr_srsg_6" />
    </movie>

    <movie>
        <name>Dredd</name>
        <when>2012</when>
        <length>1h 35m</length>
        <imdb url="https://www.imdb.com/title/tt1343727/?ref_=nv_sr_srsg_0" />
    </movie>

</superheromovies>