<?xml version="1.0" encoding="UTF-8" standalone="no"?>
<!DOCTYPE superheromovies SYSTEM "filmer.dtd"> 
   
<superheromovies>

    <movie>
        <name>Spiderman: No Way Home</name>
        <when>2021</when>
        <length>2h 28m</length>
        <imdb url="https://www.imdb.com/title/tt10872600/" />
    </movie>

    <movie>
        <name>Doctor Strange</name>
        <when>2016</when>
        <length>1h 55m</length>
        <imdb url="https://www.imdb.com/title/tt1211837/?ref_=fn_al_tt_1" />
    </movie>

    <movie>
        <name>Captain America: The First Avenger</name>
        <when>2011</when>
        <length>2h 4m</length>
        <imdb url="https://www.imdb.com/title/tt0458339/?ref_=fn_al_tt_3" />
    </movie>

    <movie>
        <name>Thor</name>
        <when>2011</when>
        <length>1h 55m</length>
        <imdb url="https://www.imdb.com/title/tt0800369/?ref_=fn_al_tt_1" />
    </movie>

</superheromovies>